{
  "id": "url-normalize.percent_escapes_are_upper_cased",
  "kind": "url-normalize",
  "description": "Other escapes stay encoded with upper-case hex digits.",
  "given": {
    "urlText": "https://www.reddit.com/r/AskHistorians/comments/xyz789/caf%c3%a9/"
  },
  "then": {
    "host": "reddit.com",
    "path": "/r/AskHistorians/comments/xyz789/caf%C3%A9",
    "pathKnown": true,
    "surface": "reddit.permalink"
  }
}
