{
  "id": "url-normalize.youtube_feed_you_is_explore",
  "kind": "url-normalize",
  "description": "The You page mixes history with recommendations and counts as an explore feed.",
  "given": {
    "urlText": "https://m.youtube.com/feed/you"
  },
  "then": {
    "host": "youtube.com",
    "path": "/feed/you",
    "pathKnown": true,
    "surface": "youtube.explore"
  }
}
