{
  "id": "url-normalize.query_fragment_port_and_userinfo_are_dropped",
  "kind": "url-normalize",
  "description": "Only the lower-cased host and the path survive.",
  "given": {
    "urlText": "HTTPS://visitor!@Old.Reddit.com:443/r/AskHistorians/comments/xyz789/a_question/?utm_source=share#comment"
  },
  "then": {
    "host": "old.reddit.com",
    "path": "/r/AskHistorians/comments/xyz789/a_question",
    "pathKnown": true,
    "surface": "reddit.permalink"
  }
}
