{
  "id": "url-normalize.youtube_hashtag_is_explore",
  "kind": "url-normalize",
  "description": "Hashtag pages are part of the explore feed.",
  "given": {
    "urlText": "https://www.youtube.com/hashtag/history"
  },
  "then": {
    "host": "youtube.com",
    "path": "/hashtag/history",
    "pathKnown": true,
    "surface": "youtube.explore"
  }
}
